{
  "$schema": "http://json-schema.org/draft-07/schema#",
  "description": "My Clients Property Links",
  "type": "object",
  "additionalProperties": false,
  "definitions": {},
  "properties": {
    "_links": {
      "type": "object",
      "additionalProperties": false,
      "description": "HATEOAS links",
      "properties": {
        "self": {
          "type": "object",
          "additionalProperties": false,
          "description": "Links to this resource",
          "properties": {
            "href": {
              "type": "string",
              "format": "uri",
              "pattern": "^https?://\\w+",
              "description": "URL for this link"
            },
            "template": {
              "type": "boolean",
              "description": "Is the HREF a RFC-6570 compliant URI Template"
            }
          },
          "required": [
            "href",
            "template"
          ]
        },
        "first": {
          "type": "object",
          "additionalProperties": false,
          "description": "Links to the first page of results for this resource",
          "properties": {
            "href": {
              "type": "string",
              "format": "uri",
              "pattern": "^https?://\\w+",
              "description": "URL for this link"
            },
            "template": {
              "type": "boolean",
              "description": "Is the HREF a RFC-6570 compliant URI Template"
            }
          },
          "required": [
            "href",
            "template"
          ]
        },
        "previous": {
          "type": "object",
          "additionalProperties": false,
          "description": "Links to the previous page of results for this resource",
          "properties": {
            "href": {
              "type": "string",
              "format": "uri",
              "pattern": "^https?://\\w+",
              "description": "URL for this link"
            },
            "template": {
              "type": "boolean",
              "description": "Is the HREF a RFC-6570 compliant URI Template"
            }
          },
          "required": [
            "href",
            "template"
          ]
        },
        "next": {
          "type": "object",
          "additionalProperties": false,
          "description": "Links to the next page of results for this resource",
          "properties": {
            "href": {
              "type": "string",
              "format": "uri",
              "pattern": "^https?://\\w+",
              "description": "URL for this link"
            },
            "template": {
              "type": "boolean",
              "description": "Is the HREF a RFC-6570 compliant URI Template"
            }
          },
          "required": [
            "href",
            "template"
          ]
        },
        "last": {
          "type": "object",
          "additionalProperties": false,
          "description": "Links to the last page of results for this resource",
          "properties": {
            "href": {
              "type": "string",
              "format": "uri",
              "pattern": "^https?://\\w+",
              "description": "URL for this link"
            },
            "template": {
              "type": "boolean",
              "description": "Is the HREF a RFC-6570 compliant URI Template"
            }
          },
          "required": [
            "href",
            "template"
          ]
        }
      },
      "required": [
        "self",
        "first"
      ]
    },
    "page": {
      "type": "integer",
      "description": "The page number"
    },
    "pageSize": {
      "type": "integer",
      "description": "The page size",
      "minimum": 10,
      "maximum": 100
    },
    "total": {
      "type": "integer",
      "description": "The total number of elements"
    },
    "propertyLinks": {
      "type": "array",
      "items": {
        "type": "object",
        "additionalProperties": false,
        "properties": {
          "_links": {
            "type": "object",
            "additionalProperties": false,
            "description": "HATEOAS links",
            "properties": {
              "self": {
                "type": "object",
                "additionalProperties": false,
                "description": "Link to this resource",
                "properties": {
                  "href": {
                    "type": "string",
                    "format": "uri",
                    "pattern": "^https?://\\w+",
                    "description": "URL for this link"
                  },
                  "template": {
                    "type": "boolean",
                    "description": "Is the HREF a RFC-6570 compliant URI Template"
                  }
                },
                "required": [
                  "href",
                  "template"
                ]
              }
            }
          },
          "id": {
            "type": "integer",
            "description": "Unique ID for this property link"
          },
          "submissionId": {
            "type": "string",
            "description": "Unique submission ID for this property link"
          },
          "status": {
            "type": "string",
            "description": "Status of this property link",
            "enum": [
              "APPROVED",
              "PENDING",
              "DECLINED",
              "REVOKED",
              "MORE_EVIDENCE_REQUIRED"
            ]
          },
          "createdDateTime": {
            "type": "string",
            "format": "date-time",
            "description": "The date and time (ISO Date Time String) of when the property link was created"
          },
          "startDate": {
            "type": "string",
            "format": "date",
            "description": "The date from which the property link is active"
          },
          "endDate": {
            "type": "string",
            "format": "date",
            "description": "The date until which the property link is active"
          },
          "uarn": {
            "type": "integer",
            "description": "The UARN (Unique Address Reference Number) of the linked property"
          },
          "address": {
            "type": "string",
            "description": "The address of the linked property"
          },
          "localAuthorityRef": {
            "type": "string",
            "description": "The local authority reference number for the linked property"
          },
          "appointedDate": {
            "type": "string",
            "format": "date",
            "description": "The date on which the agent was appointed to the property link"
          },
          "client": {
            "type": "object",
            "additionalProperties": false,
            "properties": {
              "organisationId": {
                "type": "integer",
                "description": "Unique ID for the client organisation"
              },
              "organisationName": {
                "type": "string",
                "description": "The name of the client organisation"
              }
            },
            "required": [
              "organisationId",
              "organisationName"
            ]
          }
        },
        "required": [
          "_links",
          "id",
          "submissionId",
          "status",
          "createdDateTime",
          "startDate",
          "uarn",
          "address",
          "localAuthorityRef",
          "appointedDate",
          "client"
        ]
      }
    }
  },
  "required": [
    "_links",
    "page",
    "pageSize",
    "total",
    "propertyLinks"
  ]
}