{
  "_links": {
    "self": {
      "href": "http://api.service.hmrc.gov.uk/my-organisation/clients/all/property-links?page=1&pageSize=10",
      "template": false
    },
    "first": {
      "href": "http://api.service.hmrc.gov.uk/my-organisation/clients/all/property-links?page=1&pageSize=10",
      "template": false
    },
    "next": {
      "href": "http://api.service.hmrc.gov.uk/my-organisation/clients/all/property-links?page=2&pageSize=10",
      "template": false
    },
    "last": {
      "href": "http://api.service.hmrc.gov.uk/my-organisation/clients/all/property-links?page=2&pageSize=10",
      "template": false
    }
  },
  "page": 1,
  "pageSize": 10,
  "total": 11,
  "propertyLinks": [
    {
      "_links": {
        "self": {
          "href": "http://api.service.hmrc.gov.uk/my-organisation/clients/all/property-links/PL1ZR7QBN1?projection=detailed",
          "template": false
        }
      },
      "id": 10000000000001,
      "submissionId": "PL1ZR7QBN1",
      "status": "APPROVED",
      "createdDateTime": "2017-10-01T10:10:10Z",
      "startDate": "2019-01-22",
      "uarn": 8735379000,
      "address": "BLOCK J UNIT 215 TOWER BRIDGE BUSINESS COMPLEX, CLEMENTS ROAD, LONDON, SE16 4DG",
      "localAuthorityRef": "1940002152213J",
      "appointedDate": "2019-01-22",
      "client": {
        "organisationId": 123,
        "organisationName": "Client Organisation Name"
      }
    },
    {
      "_links": {
        "self": {
          "href": "http://api.service.hmrc.gov.uk/my-organisation/clients/all/property-links/PL1ZR7QBN2?projection=detailed",
          "template": false
        }
      },
      "id": 10000000000002,
      "submissionId": "PL1ZR7QBN2",
      "status": "PENDING",
      "createdDateTime": "2017-10-01T10:10:10Z",
      "startDate": "2019-01-22",
      "uarn": 212542239,
      "address": "2ND FLR 42B, WORCESTER ROAD, BROMSGROVE, WORCS, B61 7AE",
      "localAuthorityRef": "1101911000148",
      "appointedDate": "2019-01-22",
      "client": {
        "organisationId": 123,
        "organisationName": "Client Organisation Name"
      }
    },
    {
      "_links": {
        "self": {
          "href": "http://api.service.hmrc.gov.uk/my-organisation/clients/all/property-links/PL1ZR7QBN3?projection=detailed",
          "template": false
        }
      },
      "id": 10000000000003,
      "submissionId": "PL1ZR7QBN3",
      "status": "DECLINED",
      "createdDateTime": "2017-10-01T10:10:10Z",
      "startDate": "2019-01-22",
      "uarn": 212542239,
      "address": "132, ALDSWORTH AVENUE, GORING-BY-SEA, WORTHING, WEST SUSSEX, BN12 4UU",
      "localAuthorityRef": "1101911000148",
      "appointedDate": "2019-01-22",
      "client": {
        "organisationId": 123,
        "organisationName": "Client Organisation Name"
      }
    },
    {
      "_links": {
        "self": {
          "href": "http://api.service.hmrc.gov.uk/my-organisation/clients/all/property-links/PL1ZR7QBN4?projection=detailed",
          "template": false
        }
      },
      "id": 10000000000004,
      "submissionId": "PL1ZR7QBN4",
      "status": "REVOKED",
      "createdDateTime": "2017-10-01T10:10:10Z",
      "startDate": "2019-01-22",
      "uarn": 212542239,
      "address": "117, MONTAGUE STREET, WORTHING, WEST SUSSEX, BN11 3BP",
      "localAuthorityRef": "1101911000148",
      "appointedDate": "2019-01-22",
      "client": {
        "organisationId": 123,
        "organisationName": "Client Organisation Name"
      }
    },
    {
      "_links": {
        "self": {
          "href": "http://api.service.hmrc.gov.uk/my-organisation/clients/all/property-links/PL1ZR7QBN5?projection=detailed",
          "template": false
        }
      },
      "id": 10000000000005,
      "submissionId": "PL1ZR7QBN5",
      "status": "DECLINED",
      "createdDateTime": "2017-10-01T10:10:10Z",
      "startDate": "2019-01-22",
      "uarn": 212544239,
      "address": "1, BISHOP CROFT, HIGH STREET, HENFIELD, WEST SUSSEX, BN5 9DA",
      "localAuthorityRef": "1101911000148",
      "appointedDate": "2019-01-22",
      "client": {
        "organisationId": 123,
        "organisationName": "Client Organisation Name"
      }
    },
    {
      "_links": {
        "self": {
          "href": "http://api.service.hmrc.gov.uk/my-organisation/clients/all/property-links/PL1ZR7QBN6?projection=detailed",
          "template": false
        }
      },
      "id": 10000000000006,
      "submissionId": "PL1ZR7QBN6",
      "status": "REVOKED",
      "createdDateTime": "2017-10-01T10:10:10Z",
      "startDate": "2019-01-22",
      "uarn": 212342239,
      "address": "142, ALDSWORTH AVENUE, GORING-BY-SEA, WORTHING, WEST SUSSEX, BN12 4UU",
      "localAuthorityRef": "1101911000148",
      "appointedDate": "2019-01-22",
      "client": {
        "organisationId": 123,
        "organisationName": "Client Organisation Name"
      }
    },
    {
      "_links": {
        "self": {
          "href": "http://api.service.hmrc.gov.uk/my-organisation/clients/all/property-links/PL1ZR7QBN7?projection=detailed",
          "template": false
        }
      },
      "id": 10000000000007,
      "submissionId": "PL1ZR7QBN7",
      "status": "DECLINED",
      "createdDateTime": "2017-10-01T10:10:10Z",
      "startDate": "2019-01-22",
      "uarn": 9217709000,
      "address": "BREWERS FAYRE AND PREMIER INN, FITZROY ROAD, EXETER, EX1 3LJ",
      "localAuthorityRef": "1101911000148",
      "appointedDate": "2019-01-22",
      "client": {
        "organisationId": 123,
        "organisationName": "Client Organisation Name"
      }
    },
    {
      "_links": {
        "self": {
          "href": "http://api.service.hmrc.gov.uk/my-organisation/clients/all/property-links/PL1ZR7QBN8?projection=detailed",
          "template": false
        }
      },
      "id": 10000000000008,
      "submissionId": "PL1ZR7QBN8",
      "status": "REVOKED",
      "createdDateTime": "2017-10-01T10:10:10Z",
      "startDate": "2019-01-22",
      "uarn": 1022036000,
      "address": "DRIVING TEST CENTRE, ASHLAND STREET, WOLVERHAMPTON, WV3 0BN",
      "localAuthorityRef": "1101911000148",
      "appointedDate": "2019-01-22",
      "client": {
        "organisationId": 123,
        "organisationName": "Client Organisation Name"
      }
    },
    {
      "_links": {
        "self": {
          "href": "http://api.service.hmrc.gov.uk/my-organisation/clients/all/property-links/PL1ZR7QBN9?projection=detailed",
          "template": false
        }
      },
      "id": 10000000000009,
      "submissionId": "PL1ZR7QBN9",
      "status": "DECLINED",
      "createdDateTime": "2017-10-01T10:10:10Z",
      "startDate": "2019-01-22",
      "uarn": 1022036000,
      "address": "DRIVING TEST CENTRE, ASHLAND STREET, WOLVERHAMPTON, WV3 0BN",
      "localAuthorityRef": "1101911000148",
      "appointedDate": "2019-01-22",
      "client": {
        "organisationId": 123,
        "organisationName": "Client Organisation Name"
      }
    },
    {
      "_links": {
        "self": {
          "href": "http://api.service.hmrc.gov.uk/my-organisation/clients/all/property-links/PL1ZR7QBN10?projection=detailed",
          "template": false
        }
      },
      "id": 10000000000010,
      "submissionId": "PL1ZR7QBN10",
      "status": "REVOKED",
      "createdDateTime": "2017-10-01T10:10:10Z",
      "startDate": "2019-01-22",
      "uarn": 3974063000,
      "address": "GEORGES MEETING HOUSE 38, SOUTH STREET, EXETER, EX1 1ED",
      "localAuthorityRef": "1101911000148",
      "appointedDate": "2019-01-22",
      "client": {
        "organisationId": 123,
        "organisationName": "Client Organisation Name"
      }
    },
    {
      "_links": {
        "self": {
          "href": "http://api.service.hmrc.gov.uk/my-organisation/clients/all/property-links/PL1ZR7QBN11?projection=detailed",
          "template": false
        }
      },
      "id": 10000000000011,
      "submissionId": "PL1ZR7QBN11",
      "status": "REVOKED",
      "createdDateTime": "2017-10-01T10:10:10Z",
      "startDate": "2019-01-22",
      "uarn": 3974063001,
      "address": "GEORGES MEETING HOUSE 39, SOUTH STREET, EXETER, EX1 1ED",
      "localAuthorityRef": "1101911000148",
      "appointedDate": "2019-01-22",
      "client": {
        "organisationId": 123,
        "organisationName": "Client Organisation Name"
      }
    }
  ]
}
